Company,NAIC,Phone,Website,Date
Americo Financial Life and Annuity Insurance Company,61999,(888) 220-7074,www.Americo.com,9/1/2020
Assured Life Association,56499,(855) 394-1850,www.assuredlife.org,12/1/2020
Bankers Fidelity Life Insurance Company,61239,(800) 241-1439,www.bflic.com,10/1/2020
Blue Cross Blue Sheild of Montana,70670,(406) 437-6317,www.bcbsmt.com,4/1/2021
Central States Health & Life Co. of Omaha,61751,(833) 522-4874,www.cso.com,5/1/2021
Colonial Penn Life Insurance Company,62065,(800) 523-9100,www.bankerslife.com/products/medicare-supplement-insurance,1/1/2021
"Continental Life Insurance Company of Brentwood, Tennessee",68500,(800) 264-4000,www.aetnaseniorproducts.com,3/1/2020
Everence Association,57991,(800) 348-7468,www.everence.com,4/1/2021
Federal Life Insurance Company,63223,(888) 747-3760,www.federallife.com,11/16/2020
Garden State Life Insurance Company ,63657,(888) 290-1085,www.slaico.com,1/1/2021
GPM Health and Life Insurance Company,67059,(877) 844-1036,www.gpmhealthandlife.com,10/1/2020
Guarantee Trust Life Insurance Company,64211,(847) 699-0600,www.gtlic.com,3/1/2021
Humana Insurance Company,73288,(888) 310-8482,www.humana.com,7/1/2020
Lumico Life Insurance Company,73504,(866) 440-4047,www.lumico.com,6/17/2020
Mountain Health CO-OP,75211,(402) 502-7747,www.MHC.COOP,6/1/2020
Mutual of Omaha Insurance Company,71412,(800) 667-2937,www.mutualofomaha.com/states,12/1/2020
"S.USA Life Insurance Company, Inc.",60183,(877) 990-7225,www.prosperitylife.com ,2/1/2021
State Farm Mutual Automobile Insurance Company,25178,Contact local State Farm agent,www.statefarm.com,3/1/2021
The Order of United Commercial Travelers of America (UCT),56383,(800)-848-0123,www.uct.org,1/1/2021
UnitedHealthcare Insurance Company,79413,(800) 523-5800,www.aarpmedicaresupplement.com,1/1/2021
WMI Mutual Insurance Company,68420,(801) 263-8000,www.wmimutual.com/medigap,8/5/2020
